{
  "schemaVersion": 1,
  "date": "2026-10-11",
  "level": "B1",
  "translationLanguage": "az",
  "words": [
    {
      "word": "environment",
      "ipa": "/ɪnˈvaɪrənmənt/",
      "senses": [
        {
          "partOfSpeech": "noun",
          "translation": "ətraf mühit; mühit",
          "definition": "the air, water, land, plants and animals around us; also, the conditions in which you live or work",
          "synonyms": [
            "nature",
            "surroundings"
          ],
          "antonyms": [],
          "homonyms": [],
          "examples": [
            {
              "text": "Plastic bags are bad for the environment.",
              "translation": "Plastik torbalar ətraf mühitə ziyandır."
            },
            {
              "text": "Children need a safe and happy environment at home.",
              "translation": "Uşaqlara evdə təhlükəsiz və xoşbəxt mühit lazımdır."
            }
          ]
        }
      ]
    },
    {
      "word": "pollution",
      "ipa": "/pəˈluʃən/",
      "senses": [
        {
          "partOfSpeech": "noun",
          "translation": "çirklənmə",
          "definition": "dirty or harmful things in the air, water or land, or the process of making them dirty",
          "synonyms": [
            "contamination"
          ],
          "antonyms": [],
          "homonyms": [],
          "examples": [
            {
              "text": "Air pollution in big cities is a serious problem.",
              "translation": "Böyük şəhərlərdə havanın çirklənməsi ciddi problemdir."
            },
            {
              "text": "The factory was closed because of water pollution.",
              "translation": "Fabrik suyu çirkləndirdiyi üçün bağlandı."
            }
          ]
        }
      ]
    },
    {
      "word": "protect",
      "ipa": "/prəˈtɛkt/",
      "senses": [
        {
          "partOfSpeech": "verb",
          "translation": "qorumaq, mühafizə etmək",
          "definition": "to keep someone or something safe from harm or damage",
          "synonyms": [
            "defend",
            "guard",
            "keep safe"
          ],
          "antonyms": [
            "harm",
            "attack"
          ],
          "homonyms": [],
          "examples": [
            {
              "text": "Wear a hat to protect your face from the sun.",
              "translation": "Üzünü günəşdən qorumaq üçün papaq tax."
            },
            {
              "text": "The new law protects wild animals.",
              "translation": "Yeni qanun vəhşi heyvanları qoruyur."
            }
          ]
        }
      ]
    },
    {
      "word": "recycle",
      "ipa": "/riˈsaɪkəl/",
      "senses": [
        {
          "partOfSpeech": "verb",
          "translation": "təkrar emal etmək",
          "definition": "to treat used things such as paper, glass or plastic so that they can be used again",
          "synonyms": [
            "reuse"
          ],
          "antonyms": [
            "throw away",
            "waste"
          ],
          "homonyms": [],
          "examples": [
            {
              "text": "We recycle all our paper and plastic bottles.",
              "translation": "Biz bütün kağızlarımızı və plastik butulkalarımızı təkrar emala veririk."
            },
            {
              "text": "This bag is made from recycled plastic.",
              "translation": "Bu torba təkrar emal olunmuş plastikdən hazırlanıb."
            }
          ]
        }
      ]
    },
    {
      "word": "species",
      "ipa": "/ˈspiʃiz/",
      "senses": [
        {
          "partOfSpeech": "noun",
          "translation": "növ (canlı növü)",
          "definition": "a group of animals or plants of the same kind that can have young ones together",
          "synonyms": [
            "kind",
            "type"
          ],
          "antonyms": [],
          "homonyms": [],
          "examples": [
            {
              "text": "There are hundreds of species of birds in this national park.",
              "translation": "Bu milli parkda yüzlərlə quş növü var."
            },
            {
              "text": "Scientists discovered a new species of frog.",
              "translation": "Alimlər yeni bir qurbağa növü kəşf etdilər."
            }
          ]
        }
      ]
    },
    {
      "word": "wildlife",
      "ipa": "/ˈwaɪldˌlaɪf/",
      "senses": [
        {
          "partOfSpeech": "noun",
          "translation": "vəhşi təbiət, yabanı heyvanlar",
          "definition": "animals, birds and plants that live free in nature",
          "synonyms": [
            "nature"
          ],
          "antonyms": [],
          "homonyms": [],
          "examples": [
            {
              "text": "The national park is home to a lot of wildlife.",
              "translation": "Milli park çoxlu yabanı heyvanın məskənidir."
            },
            {
              "text": "Pollution is a danger to wildlife.",
              "translation": "Çirklənmə vəhşi təbiət üçün təhlükədir."
            }
          ]
        }
      ]
    },
    {
      "word": "climate",
      "ipa": "/ˈklaɪmət/",
      "senses": [
        {
          "partOfSpeech": "noun",
          "translation": "iqlim",
          "definition": "the usual weather of a place over a long period of time",
          "synonyms": [],
          "antonyms": [],
          "homonyms": [],
          "examples": [
            {
              "text": "Lankaran has a warm and wet climate.",
              "translation": "Lənkəranın iqlimi isti və rütubətlidir."
            },
            {
              "text": "Climate change is one of the biggest problems today.",
              "translation": "İqlim dəyişikliyi bu günün ən böyük problemlərindən biridir."
            }
          ]
        }
      ]
    },
    {
      "word": "harm",
      "ipa": "/hɑrm/",
      "senses": [
        {
          "partOfSpeech": "verb",
          "translation": "zərər vermək, ziyan vurmaq",
          "definition": "to hurt or damage someone or something",
          "synonyms": [
            "hurt",
            "damage",
            "injure"
          ],
          "antonyms": [
            "protect",
            "help"
          ],
          "homonyms": [],
          "examples": [
            {
              "text": "Too much sun can harm your skin.",
              "translation": "Həddindən artıq günəş dərinizə zərər verə bilər."
            },
            {
              "text": "No animals were harmed during the making of this film.",
              "translation": "Bu filmin çəkilişi zamanı heç bir heyvana zərər verilməyib."
            }
          ]
        },
        {
          "partOfSpeech": "noun",
          "translation": "zərər, ziyan",
          "definition": "damage or injury to someone or something",
          "synonyms": [
            "damage",
            "injury",
            "hurt"
          ],
          "antonyms": [
            "benefit",
            "good"
          ],
          "homonyms": [],
          "examples": [
            {
              "text": "A little coffee won't do you any harm.",
              "translation": "Bir az qəhvə sənə heç bir zərər verməz."
            },
            {
              "text": "He didn't mean any harm – it was just a joke.",
              "translation": "Onun pis niyyəti yox idi – bu, sadəcə zarafat idi."
            }
          ]
        }
      ]
    },
    {
      "word": "preserve",
      "ipa": "/prɪˈzɝv/",
      "senses": [
        {
          "partOfSpeech": "verb",
          "translation": "qoruyub saxlamaq, mühafizə etmək",
          "definition": "to keep something in its original state, or to keep it safe from damage or change",
          "synonyms": [
            "protect",
            "keep",
            "save"
          ],
          "antonyms": [
            "destroy",
            "damage"
          ],
          "homonyms": [],
          "examples": [
            {
              "text": "The town has preserved its old buildings.",
              "translation": "Şəhər köhnə binalarını qoruyub saxlayıb."
            },
            {
              "text": "We must preserve these forests for the future.",
              "translation": "Bu meşələri gələcək üçün qoruyub saxlamalıyıq."
            }
          ]
        }
      ]
    },
    {
      "word": "extinct",
      "ipa": "/ɪkˈstɪŋkt/",
      "senses": [
        {
          "partOfSpeech": "adjective",
          "translation": "nəsli kəsilmiş",
          "definition": "no longer existing, because all the animals or plants of this kind have died",
          "synonyms": [],
          "antonyms": [
            "living",
            "alive"
          ],
          "homonyms": [],
          "examples": [
            {
              "text": "Dinosaurs became extinct millions of years ago.",
              "translation": "Dinozavrların nəsli milyonlarla il əvvəl kəsilib."
            },
            {
              "text": "Some kinds of tigers are already extinct.",
              "translation": "Bəzi pələng növlərinin nəsli artıq kəsilib."
            }
          ]
        }
      ]
    },
    {
      "word": "plastic",
      "ipa": "/ˈplæstɪk/",
      "senses": [
        {
          "partOfSpeech": "noun",
          "translation": "plastik",
          "definition": "a light, strong material made from chemicals and used to make many things",
          "synonyms": [],
          "antonyms": [],
          "homonyms": [],
          "examples": [
            {
              "text": "This chair is made of plastic.",
              "translation": "Bu stul plastikdən hazırlanıb."
            },
            {
              "text": "We use too much plastic in our daily lives.",
              "translation": "Gündəlik həyatımızda həddindən artıq plastik işlədirik."
            }
          ]
        },
        {
          "partOfSpeech": "adjective",
          "translation": "plastik",